station_id,exitNumber,title_ru,lat,lon,bus,trolleybus,tram
1,2,"Выход №2 к Ивантеевской улице 25, к 5-му и 6-му проезда Подбельского",55.815349,37.732905,"80, 86, 265, 311",,"4, 7, 46"
1,3,"Выход №3 к Открытому шоссе 9, к ТЦ «Подсолнухи», к Ивантеевской улице",55.814137,37.735615,,,46
1,4,"Выход №4 к Открытому шоссе 5, к улице Ивантеевская",55.813446,37.735142,"3, 327, 822, 75, 775",,
1,5,"Выход №5 к Открытом шоссе 3, к Тюменскому проезду, к Тюменской улице, Бульвар Маршала Рокоссовского",55.813227,37.735145,,,"13, 36"
1,1,"Выход №1 к Ивантеевской улице 32, к бульвару Маршала Рокоссовского, к 7-му проезду Подбельского, к Бойцовской улице",55.815012,37.732025,,,
22,3,"Выход №3 к Олимпийскому комплексу «Лужники», на Большую спортивную арену, на Малую спортивную арену",55.711828,37.560945,,,
22,4,"Выход №4 к СК «Дружба», на Лужнецкую набережную, к Олимпийскому комитету России, на Новолужнецкий проезд",55.711629,37.561387,,,
22,2,"Выход №2 на Андреевскую набережную, на Воробьёвскую набережную, к улице Косыгина, в заказник «Воробьёвы горы», к причалу «Воробьёвы горы», на смотровую площадку на Воробьёвых горах, к Эскалаторной галерее",55.708783,37.557153,"297, c10",,
22,1,"Выход №1 на Андреевскую набережную, на Воробьёвскую набережную, в Заказник «Воробьёвы горы», на причал «Воробьёвы горы», на смотровая площадка на Воробьёвых горах, к Эскалаторной галерее",55.709309,37.55762,,,
24,1,"Выход №1 к гостиница «Комета», на Проспект Вернадского 16",55.676517,37.504446,,,
24,2,"Выход №2 к кинотеатру «Каро Звёздный», на проспект Вернадского 14, к улице Удальцова",55.676694,37.504762,,,
24,3,"Выход №3 на проспект Вернадского, к памятнику Ю.А. Гагарину",55.676238,37.5050632,830,,
24,4,"Выход №4 к проспекту Вернадского, к улице Лобачевского",55.676232,37.504976,"т34, 224, 715, с17, 793",,
24,5,"Выход №5 на проспект Вернадского, к улице Удальцова",55.67618,37.505642,"т34, 120, 224, 661, 42",,
24,6,"Выход №6 на проспект Вернадского, к БЦ «Вернадский», к ТЦ «Премьер»",55.676012,37.505348,"42, с163",,
24,7,"Выход №7 к парку им: 50-летия Октября, к проспекту Вернадского, к ТЦ «Обувь-сити», к улице Удальцова, к улице Кравченко",55.677917,37.507321,"т34, 120, 224, 616, 661, с17, 153",,
26,1,"Выход №1 на Проспект Вернадского, к Ленинскому проспекту, к улице 26 Бакинских Комиссаров",55.662752,37.483269,"м16, 250, 261, 374, 404, 752, 226, 699, н11",,
26,2,"Выход №2 на Проспект Вернадского, к Ленинскому проспекту, к улице 26 Бакинских Комиссаров, к Центральной библиотеке №202 им. Ю.А. Гагарина, к театру на Юго-Западе ",55.662566,37.483117,"т34, 227, 329, 485, 610, 667, 688, 196, 520, 630, 785к, 950",,
26,3,"Выход №3 к Проспекту Вернадского, к ТРЦ «Альмирал», к автобусам в аэропорт Внуково (VKO), к МПГУ",55.662776,37.482069,"227, 281, 329, 361, 485, 642, 66, 196, 518, 520, 611, 630, 718, 877, 461",,
26,4,"Выход №4 на Проспект Вернадского 86, к улице Покрышкина, на Рузскую улицу, к Университету Тонких Химических Технологий им. М.В. Ломоносова",55.663006,37.482174,"343, 950",,
26,5,"Выход №5 на Проспект Вернадского, к улице Покрышкина 2, к ТЦ «Звёздочка», к РАНХиГС при Президенте РФ",55.664592,37.483194,"329, 610, 66, 226, 630, 699, 890, 590",,
26,6,"Выход №6 на Проспект Вернадского, к Университету информационных технологий, радиотехники и электроники (МИРЭА)",55.664775,37.48336,"227, 250, 261, 485, 667, 688, 785к",,
26,7,"Выход №7 на Проспект Вернадского 101, к улице Лобачевского",55.66455,37.48433,"т34, 219, 688, 785к",,
26,8,"Выход №8 на улицу 26 Бакинских комиссаров, на проспект Вернадского 105, к ТЦ «Премьера», в Юго-западный лесопарк",55.664353,37.484214,"м16, 330, 374, 752, 196, 518, 520, 718, н11",,
7,1,"Выход №1 к Фестивальной улице 13, к Ленинградскому шоссе, к ТЦ «У речного», на Смольную улицу",55.855754,37.475659,"т58, 199, 400, 173, 451",,
7,2,"Выход №2 к улице Фестивальная 2, к ТРЦ «Речной»,  к парку Дружбы, к Ленинградскому шоссе, к Северному речному вокзалу",55.854273,37.476631,"90, 188, 233, 270, 284, 673, 745, 851, 857, 283, 338, 801, 958, 342, 342к, 343, 370, 443, 481, 482, 532к, 949, 986к",,
102,1,"Выход №1 на Кутузовский проспект, к улице Алексея Свиридова, на Рублёвское шоссе ",55.728983,37.468852,,,
102,2,"Выход №2 к улицам Герасима Курина, Тарутинская, Кастанаевская ",55.730705,37.472258,,,
102,3,"Выход №3 к улице Кастанаевская, к Можайскому плодовому саду",55.730228,37.473149,"157, 231, 329, 341, 464, 641, 732, 840, 77, 103, 104, 157к, 325, 622, 139, 818, 819к, н2",,
102,4,"Выход №4 к Кутузовскому проспекту, к Славянскому бульвару,  к ТРЦ «Океания», к остановкам наземного транспорта",55.72933,37.472938,,,
129,1,"Выход №1 На Минскую улицу, на Малую Филёвскую улицу",55.739652,37.483741,"е29, 107, 231, 104, 130, 135, 139, 818",,
129,2,"Выход №2 На Минскую улицу, 14а, к улице Олеко Дундича, на Сеславинскую улицу, к Городской клинической больнице №51",55.739462,37.483037,"т54, 73, 104, 130, 155",,
8,5,"Выход №5 к стадиону «РЖД Арена», к ТЦ «Черкизовский пассаж»",55.805145,37.74455,,,
8,4,"Выход №4 к стадиону «РЖД Арена», к ТЦ «Черкизовский пассаж»",55.804754,37.744535,"469, 552",,
8,1,"Выход №1 к стадиону «РЖД Арена», к улице Большая Черкизовская, к Щёлковскому шоссе, к ТЦ «Радуга», к Окружному проезду, к Восточному вокзалу",55.802792,37.744798,"т32, т41, т83, 230, 449, 469, 552, 716, 974, 34, 34к, 52, 171, 372, н15, 860, 1251к, 1716",,
11,1,"Выход №1 к улицам Краснопрудная, Верхняя Красносельская, Нижняя Красносельская, Русаковская, к ТЦ «Тройка», к ТТК",55.779981,37.666102,"т14, т41, 440, 40, с633, н15",,"4, 7, 13, 37, 43, 50"
12,1,"Выход №1 к пригородным поездам Ленинградского и Ярославского направления, к Ярославскому вокзалу",55.776744,37.655897,,,
12,2,"Выход №2 к Ленинградскому и Ярославскому вокзалам, к станции «Каланчёвская» МЦД-2, к улице Краснопрудная",55.776203,37.656273,"т14, 40, с633, н15",,"7, 13, 37, 50"
12,4,"Выход №4 к Казанскому вокзалу, пригородным поездам и поездам дальнего следования",55.773605,37.65625,,,
12,7,"Выход №7 к Ленинградскому вокзалу, к станции «Каланчёвская» МЦД-2, к музею Таможенной Федеральной службы России",55.775701,37.655248,,,
12,9,Выход №9 к трамваям в сторону центра,55.775489,37.656059,,,"7,13,37,50"
12,12,Выход №12 к Казанскому вокзалу,55.774887,37.656212,,,
12,11,"Выход №11 к Казанскому вокзалу, к универмагу «Московский»",55.775113,37.656599,,,
12,8,"Выход №8 к Ярославскому и Ленинградскому вокзалам, к пригородным кассам Ярославского и Ленинградского направления",55.775827,37.655892,,,
12,10,"Выход №10 к трамваям в сторону м. «Красносельская», к памятнику П.П. Мельникову",55.775272,37.655768,,,
12,14,"Выход №14 (только вход и переход) к Новорязанской улице, к кассам дальнего следования Казанского вокзала",55.772736,37.658365,,,
12,13,"Выход №13 (только вход и переход) к Новорязанской улице, к Басманному переулку, ко 2 троллейбусному парку",55.77286,37.658982,,,
12,3,"Выход №3 на Комсомольскую площадь, к Казанскому вокзалу, к ЦДКЖ, к универмагу «Московский», к Рязанскому проезду, к улицам Каланчёвская и Краснопрудная",55.774439,37.655685,"т14, т22, т41, т88, 40, с633, н15",,
13,2,"Выход №2 к улицам Каланчёвская и Новая Басманная, к Высотному зданию на Красных Воротах",55.769753,37.650333,"Б, т24, с633, Б(ночной) ,н15",,
13,1,"Выход №1 на ул.: Садовая-Черногрязская, Садовая-Спасская, Мясницкая, Боярский переулок, к МНИИ глазных болезней им. Гельмгольца, к пассажирскому агенству метрополитена",55.768316,37.648042,"Б, с633, Б(ночной) ,н15",,
15,10,"Выход №10 на Лубянскую площадь, к гостинице «St Regis Никольская», к Никольской улице, на Большой Черкасский переулок, к ТЦ «Нaутилус», на Третьяковский проезд",55.758994,37.62583,,,
15,11,"Выход №11 к Центральному детскому магазину, на Театральный проезд, к улицам Рождественка, Неглинная, Пушечная",55.759834,37.625147,"м2, м3, м6, м7, м9, е10, е30, м40, с538, н1, н2, н6, н9, н11, н12, н15, м40(ночной)",,
15,2,"Выход №2 к улицам Большая Лубянка, Пушечная, Кузнецкий мост, на Лубянскую площадь",55.760007,37.627939,,,
15,9,"Выход №9 к улице Никольская, на Лубянскую площадь, к ТЦ «Наутилус», к Театральному проезду, к музыкальному театру им Б.А. Покровского, к гостинице «Метрополь»",55.759011,37.626016,,,
15,4,"Выход №4 к Мясницкой улице; к торговому дому «Библио-глобус», к музею В.В. Маяковского, к Высшей школе экономики, к Большому Златоустинскому переулку",55.759578,37.628474,,,
15,7,"Выход №7 к Политехническому музею, на Новую площадь, к Политехническому проезду",55.758922,37.627138,"м3, м6, м7, е10, е30, м40, м90, с538, с920, н1, н2, н3, н6, н9, н11, н12, н15, м40(ночной)",,
15,3,"Выход №3 к улицам Мясницкая и Малая Лубянка, на Фуркасовский переулок",55.759976,37.628416,,,
15,6,"Выход №6 к Политехническому музею, на Лубянский проезд, на Политехнический проезд",55.759204,37.628073,,,
15,8,"Выход №8 на Новую площадь 2, на Малый Черкасский переулок, на Большой Черкасский переулок, к Гостинице «St Regis Никольская»",55.758802,37.626311,,,
15,5,"Выход №5 на Лубянский проезд, к переулку Лучников, к площади Ильинские ворота",55.759361,37.628329,"м3, м6, м7, е10, е30, м40, с538, с633, н1, н2, н6, н9, н11, н12, м40(ночной)",,
16,1,"Выход №1 к улицам Моховая, Тверская, Большая Никитская, к гостинице «Националь», к Геологическому музею им. В. И. Вернадского, к Институту стран Азии и Африки МГУ",55.756887,37.614524,,,
16,2,"Выход №2 к улице Тверская 1, к театру им. Ермоловой, к центральному телеграфу, к переулкам Никитский и Газетный",55.757051,37.614356,"м1, с344",,
16,3,"Выход №3 к улице Тверская 4, на Камергерский переулок, к МХТ им. А. П. Чехова, на Георгиевский переулок",55.757313,37.61474,"м1, е30, м40, н1, н12, м40(ночной)",,
16,4,"Выход №4 к улице Охотный ряд 1, к Государственной Думе, к улице Большая Дмитровка, к концертному залу «Дом союзов»",55.757201,37.615039,,,
16,6,"Выход №6 на Манежную площадь, к ТЦ «Охотный ряд», к Центральному выставочному центру «Манеж», к гостинице Four Seasons «Москва»",55.756669,37.615916,,,
16,7,"Выход №7 на Красную площадь, к Государственному историческому музею, к Музею Отечественной войны 1812 г., к Кремлю, в Алексадровский сад, к «ГУМ»",55.756068,37.617673,,,
16,8,"Выход №8 к улице Большая Дмитровка, к Большому театру, к Малому театру, к «ЦУМ», к Тверской улице, к Российскому академическому молодёжному театру",55.758666,37.617506,,,
16,5,"Выход №5 к улице Охотный ряд 2, на Манежную площадь, к гостинице Four Seasons «Москва», к торговой галерее «Модный сезон»",55.756836,37.615661,"м2, м3, м6, м7, м9, е10, е30, м40, н1, н2, н11, н12, м40(ночной)",,
16,9,"Выход №9 к улице Большая Дмитровка, к Большому театру, к Малому театру, к ЦУМ, к Тверской улице, к Российскому академическому молодёжному театру",55.75877,37.617927,"м2, м3, м6, м7, м9, е10, с538, н2, н6, н11",,
17,4,"Выход №4 к Центральному выставочному залу «Манеж», к Манежной улице, к кассам музеев Московского Кремля",37.611605,55.752215,"м1, м6, м9, е10, н11",,
17,5,"Выход №5 к Александровскому саду, к Кремлю, к Государственному Кремлёвскому дворцу, к кассам музеев Московского Кремля",37.612331,55.751875,,,
17,6,"Выход №6 к улицам Воздвиженка и Моховая, к Староваганьковскому переулку, к Российской государственной библиотеке",37.608989,55.752233,,,
17,1,"Выход №1 к улицам Знаменка, Волхонка, Моховая, к Боровицкой площади, к дому Пашкова",37.610247,55.751949,"м1, м6, м9, е10, н11",,
17,2,"Выход №2 к улице Воздвиженка, к Российской государственной библиотеке",37.610083,55.752238,"м2, м7, н2",,
17,3,"Выход №3 к улицам Моховая, Большая Никитская, Воздвиженка, к Зоологическому музею МГУ, к Институту стран Азии и Африки МГУ",37.610713,55.75253,"м2, м7, н2",,
17,7,"Выход №7 к улицам Моховая, Волхонка и Знаменка, к дому Пашкова",37.609206,55.750508,"м1, м6, м9, е10, н11",,
18,2,"Выход №2 к Храму Христа Спасителя, к улице Волхонка, к Музею изобразительных искусств А.С. Пушкина, к Галерее Ильи Глазунова",55.745865,37.605375,м6,,
18,1,"Выход №1 на Гоголевский бульвар, к улице Пречистенка, к улице Остоженка",55.744975,37.601687,"м5, м6, с755",,
21,1,"Выход №1 к Олимпийскому комплексу «Лужники», к улице Хамовнический Вал, к улице Доватора, к улице Усачёва, на Комсомольский проспект",55.72227,37.561924,"м5, с249, с263, с755",,
21,2,"Выход №2 к улице 10-летия Октября, к театру Е. Камбуровой, к улице Усачёва, к Новодевичьему женскому монастырю",55.723834,37.565774,"м6, 220, с216",,
23,1,"Выход №1 на Ломоносовский проспект, к проспекту Вернадского, к МГУ им. М. В. Ломоносова, к Большому Московскому цирку, к ТЦ «Капитолий»",55.693325,37.534499,"м19, е29, т34, 67, 119, 138, 266, 394, 845, 1, 103, 111, 113, 130",,
23,2,"Выход №2 на проспект Вернадского, на Ломоносовский проспект, к улице Строителей, на Ленинский проспект, к Большому Московскому цирку",55.691812,37.53476,"е29, т34, 138, 266, 434, 464, 470, 661, 845, 1, с10, 111, 113, 260",,"14, 26, 39"
33,1,"Выход №1 к Тропарёвскиому лесопарку, к автобусам в аэропорт Внуково (VKO)",55.645343,37.471732,,,
33,3,Выход №3 на Ленинский проспект ,55.645056,37.472092,"е10, 227, 281, 343, 485, 553, 642, 518, 611, 816, 877, 890, 1147, 590",,
33,4,"Выход №4 на Ленинский проспект, на МКАД, к Тропарёвскому лесопарку",55.644753,37.471436,,,
33,5,"Выход №5 на Ленинский проспект, к улице Островитянова",55.644593,37.472813,"227, 343, 485, 642, 518, 611, 877, 890, 590 ",,
33,2,"Выход №2 к улице Академика Анохина, к Ленинскому проспекту, к Тропарёвскому лесопарку",55.644972,37.470937,,,
33,6,"Выход №6 на Ленинский проспект, к улице Академика Бакулева, на Теплостанский проезд, к Заказник «Тёплый Стан»",55.644272,37.472118,"е10, 281, 553, 816",,
33,7,"Выход №7 на Рузскую улицу, к Военной Академии Генштаба Вооружённых сил РФ, к парку «Никулино», к Первому МГМУ им. И.М. Сеченова",55.646572,37.474327,,,
33,8,"Выход №8 на Рузскую улицу, к Тропарёвскому лесопарку, к автобусу в аэропорт Внуково (VKO)",55.646166,37.473526,,,
34,1,"Выход №1 к бизнес-парк «Румянцево», в Румянцево, к Киевскому шоссе, к гостиницу «Инсайд транзит», к бизнес-центру «Комсити»",55.632941,37.439652,,,
34,2,"Выход №2 к Киевскому шоссе, к бизнес-парку «Румянцево», к автобусам в аэропорт Внуково (VKO)",55.633038,37.443478,"343, 485, 611, 890, 590",,
36,1,"Выход №1 к Хованскому Западному кладбищу, к деревне Картмазово",55.601366,37.409195,"169, 272, 420, 472, 866, 876",,
36,2,"Выход №2 к СНТ «Филатов Луг», к городу Московский, к Ульяновскому лесопарку",55.600684,37.406951,"189, 272, 472, 866, 876",,
37,1,"Выход №1 к деревне Прокшино, к ЖК «Дубровка»",55.585901,37.432816,"982, МЦ2, 313",,
37,2,"Выход №2 к ЖК «Испанские кварталы», к СНТ «Дружба», к  коттеджному посёлку «Соловьиная роща», к Хованскому пруду",55.586848,37.433903,"982, 313, 472",,
38,1,"Выход №1 к Калужскому шоссе, к АДЦ «Коммунарка», к ЖК «Дубровка», к Медицинскиому центру «Новомосковский», к префектуре ТиНАО",55.569247,37.458847,"101, 398, 433, 521, 991, с19, 303, 422, 503, 508, 512, 513, 514, 515, 526, 531, 577, 878, 976, 522, 887, 894, 1040",,
2,4,Выход №4 к улице Дыбенко 7,55.877584,37.481514,270,,
2,1,"Выход №1 к автовокзалу «Северные ворота», к Прибрежному и Библиотечному проездам, к улице Дыбенко, к Ледовому дворцу «Умка»",55.87927,37.480653,"270, 65, 958",,
2,5,"Выход №5 к улице Дыбенко 42, к улице Зеленоградская, к парку «Берёзовая роща»",55.877368,37.482346,"673, 745, 283, 958",,
2,6,"Выход №6 к улице Дыбенко 5, к Конноспортивной базе «ЦСКА»",55.87697,37.481468,"188, 594, 673, 283, 958",,
2,2,Выход №2 к городским и пригородным автобусам ТПУ «Ховрино»,55.87853,37.479912,"е41, 283к, 368, 892к, 1274к, 1195",,
2,3,Выход №3 к городским и пригородным автобусам ТПУ «Ховрино»,55.87799,37.480214,"200, 270, 559, 344, 345, 465",,
41,4,"Выход №4 к Ленинградскому проспекту 72, к улице Усиевича, к улице Лизы Чайкиной, к улице авиаконструктора Яковлева",55.80497,37.516844,,,
41,1,"Выход №1 к Ленинградскому проспекту, к улицам Алабяна и Песчаной, к Волоколамскому шоссе",55.804454,37.514314,"м1, е30, 905, т6, 26, т43, т59, т70, 100, т86, 105, 175, 291, с356, 412, 456к, 597, н1, н12",,"6, 15, 23, 28"
41,2,"Выход №2 к Ленинградскому проспекту, к ТЦ «Метромаркет», к Балтийской улице, к Ленинградскому шоссе, к улице Усиевича",55.805558,37.515245,"м1, е30, 905, т6, т43, т70, 132, 105, 105к, 110, с356, 412, 456к, н1, н12",,
41,3,Выход №3 к Ленинградскому проспекту,55.805091,37.516374,,,
41,5,"Выход №5 к Ленинградскому проспекту, к Песчаной улице, к Новопесчаной улице, к Чапаевскому парку, к Чапаевскому переулку",55.804211,37.516295,,,
41,6,"Выход №6 к Ленинградскому проспекту 71, к театру «Центр драматургии и режессуры»",55.804354,37.515689,,,
42,1,"Выход №1 к Ленинградскому проспекту 62, к улице Черняховского, к Красноармейской улице; к 1-ой Аэропортовской улице",55.801034,37.532068,,,
